0,Congressman Thad McCotter ends bid for U.S. president
0,"In Stem Cell Debate, Moral Suasion Comes Up Short"
0,"Massive anti-government protests in Egypt continue into second day, several killed"
1,Is Armpit Hair Sexy On Women
1,"Alan Rickman Narrates The New ""Alice Through The Looking Glass"" Trailer"
1,This Puzzle Is For Everyone Who Suffers From Bug Bites
0,Hiker missing from US state of Utah wilderness found in Australia
1,Remember When Anderson Cooper Was A Reality TV Host
0,Scientists in Germany Draft Neanderthal Genome
1,9 Slightly Disturbing Facts That Will Stop You From Cleaning Your Ears Ever Again
0,Gunman kills eight at Jerusalem school
0,2 Ex-Detainees in Qaeda Video
0,"A Governor Says No to Money, and Reaps Boos"
1,10 Italian Dishes Your Nonna Would Be Proud Of
0,U.S. Raises Fuel Mileage Standards for 2011
0,General who oversaw military tribunals at Guantanamo is being investigated for abuse of power
1,14 Dogs Who Definitely Didn't Peek At Their Presents
1,17 Things People Who Don't Need Glasses Will Never Understand
0,Baseball Fights Fakery With an Army of Authenticators
1,21 Pictures Literally Every Girl Has Taken
1,This Spoof Kids Book About Hipsters Is Hilarious
0,"Add Nuts to Your Diet With Sauces, Not Snacks"
1,We Bet You Can't Name All 30 NHL Teams In 5 Minutes
1,"22 Hilarious Pictures Only ""The Walking Dead"" Fans Will Understand"
1,The 29 Most WTF TV Moments Of 2015
0,Where Iron Is Bigger Than Oil or Gold
0,U.S. to Use Bailout Repayments to Aid Small Banks
0,Australian anti-terror laws will be delayed
0,Arrest warrant issued for Tom DeLay
1,Which Tennis Player Should Be Your BFF Based On Your Zodiac Sign
1,Drake and Jay Z Clearly Had A Blast At The Warriors Game
0,"Portions of Wikileaks, Wikipedia blocked in Australia"
0,Afghan Women Protest New Law on Home Life
0,"Maine resident arrested in Florida for death threats to Bush, Obama"
0,"Civilians testify to Halliburton fraud, coercion"
1,19 Illustrations That Sum Up Being In A Relationship When You Have ADHD
0,Ex-Credit Suisse Executive Named to Run UBS
0,Court Favors Karzai Term Until Election
1,This 3-Year-Old Knows Way More About The Periodic Table Than You
0,Australian Senate Committee recommends formation of Charities Commission
1,Can You Spell These Commonly Misspelled Canadian Words
1,7 Postcards For People In Long-Term Relationships
1,19 Actually Stylish Men To Follow On Instagram
1,What's The Weirdest Thing Your Dog Does
1,There's An Incredibly Creepy New App That Brings Your Pictures To Life
0,Pakistani Woman Who Shattered Stigma of Rape Is Married
1,17 Of The Most Hilarious Amazon Reviews Of 2015
1,"Do You Remember The Lyrics To ""Last Friday Night"" By Katy Perry"
1,21 Puppies Who Are On The Naughty List This Year
1,Quick Question: What Are Some Beauty Secrets Your Indian Mum Told You
0,"Four injured after three earthquakes strike Sumatra, Indonesia"
0,Fund-Raising Still Has Its Perks in the Obama Era
1,"Meet The Very First Transgender Bride On ""Say Yes To The Dress"""
0,Selling Old Yankee Stadium One Memento at a Time
1,The Returned Gets Even Creepier In Season 2
0,"As Giants Pack Up, Issues and Chagrin Linger"
0,"Reinstated, Chief Justice Bears Hopes of Pakistan"
0,Boat accident in Democratic Republic of the Congo kills at least 73
1,"34 ""I Laughed So Hard I Cried"" Stories"
1,This Is How Much Halloween Has Changed Over The Years
1,55 Carly Rae Jepsen Lyrics You Should Definitely NOT Say To Your New Crush
0,Stock exchange merger could end San Francisco stock trading
1,"This Airbnb Is A ""Netflix And Chill"" Utopia"
0,Third-Place Finish Helps Spain Recover From Semifinal Loss
0,Retrial Ordered in Killing of a Russian Journalist
0,Injured NASA astronaut replaced on crew of upcoming mission
0,"Tornado strikes London, injuring six"
0,Spectator killed and 10 injured in German airshow crash
0,"Australian rules football: Gippsland Football League heavyweights clash, Maffra go two games clear"
0,Up to one-half of Somali food aid diverted from needy
1,15 Reasons Arjun Kapoor Is The Perfect Man
0,Space Shuttle Discovery launches on mission STS-124
0,"DNA Tests Prove Michigan Man, Searching for Origins, Was Not Kidnapped Toddler"
1,22 Insanely Adorable DIY Decorations For Holiday Parties
0,Thousands flee after volcano begins to erupt in Colombia
0,Intel Shifts Image Advertising to a Smaller Agency
1,Are These Pumpkin Spice Products Real Or Fake
1,26 Clever Products That Will Make Your Office So Much Better
1,How Dirty Minded Are You Really
1,We Tried Edible Lingerie For Valentine's Day And It's Absolutely Horrifying
0,Prince Laurent of Belgium testifies in marine fraud case
1,26 Confessions About Canada's New Prime Minister
0,"An Australian child's vocabulary: it's ""I"" before ""we"", both before ""you"""
1,Nick Cannon Kind Of Predicted Mariah Carey Would Leave Him For A Billionaire
0,Chinese Officials Say Tests Clear Formula Company
0,Bonds Judge Wants to Question Anderson
0,"In Siberia, the Death Knell of a Complex Holding a Deadly Stockpile"
1,The One Way To Ask Someone Out
0,Angry driver takes out cyclist pack
0,Tighten 'noose' so Osama can't operate: Obama
0,Suicide Bomber Kills 30 in Baghdad Pilgrimage Attack
1,The World's Most Controversial High-Wire Walker Has A Plan To Take Over Entertainment
1,What's A Word Only Disney Fans Will Understand
0,Papua New Guinea Culture and Tourism minister charged with attempted murder
0,Woman in Binghamton Athletics Files Harassment Complaint
0,"Environmentalists: ""Turn everything off!"" on February 1st"
1,"Which ""Inside Amy Schumer"" Character Are You"
0,Vodafone New Zealand buys Internet provider ihug
0,A Company Plans to Market Illiquid Assets
1,17 Outrageously Cozy Throws To Snuggle Up With
0,Italian political leader threatens forcible rebellion against government
1,Which Male Disney Character Are You
0,Slovak bus accident kills 12
1,Facebook Is Going Wild For This Organist Paying An Emotional Tribute To David Bowie
1,26 Movies That Will Ruin Your Appetite
1,12 Aussies Reveal What They Love And Hate About Britain
0,Canada's Afghan mission in question
1,Miss Piggy And Kermit Can't Have A Business Meeting Without Drama
0,Chrysler and Union Agree to Deal Before Federal Deadline
1,This Comic Sums Up The Terrors Of Public Speaking
0,Naval Show to Feature Submarines From China
0,Chinese rioters storm Japanese embassy in Beijing
1,Veterans Open Up About What It's Like To Kill Someone In War
0,Norwegian politicians face voter suppression allegations
0,Italian MP starts thirst and hunger strike to protest Saddam execution
1,19 Wildly Adorable Products You Definitely Need In Your Life
0,Unemployment in Spain Reaches 17.4%
0,"Over 70 businesses in Bristol, United Kingdom given zero star rating for food hygiene"
1,"Michael J Fox And Christopher Lloyd Crashed ""Jimmy Kimmel Live"" As Marty McFly And Doc Brown"
0,Six killed in UK car crash
1,India's First Transgender Band Just Released Their First Song And It Will Leave You Speechless
0,Shuttle Set to Lift Off With Station Parts
1,Avril Lavigne And Nick Carter Released A Single And It's A Pop Dream
1,26 Things French People Find Kind Of Strange About The U.S
1,23 Sibling Photo Shoots That Will Make You Want Another Baby
0,Three firefighters killed in blaze at Chinese plastics factory
0,Panel Suggests Higher Gas Tax to Help Rebuild Roads
0,"Adults Spend 8 Hours a Day in Front of a Screen, Study Finds"
0,Toyota to recall Sienna minivan in North America
0,American Executive Fired in China Bribery Case
0,"Guantanamo prisoner seeks UK citizenship, asylum"
1,"Zayn Malik's ""Zitties"" Are Driving People Insane"
0,"As Veterans Move Up, Leaders in Full Bloom at Augusta"
0,"Shuttle Docks, and Astronauts Number 13 on Station"
0,100m record beaten in Rieti
0,2 Die in Clash in India
1,Somebody Tell Twitter We Need To Be Able To Edit Our Damn Tweets
0,Profit Is Cut Nearly in Half at 3M
0,Toy maker Mattel recalls more products
1,"These Three Questions Will Determine Which ""Harry Potter"" Book Is Most Like Your Life"
0,Tropical Storm Epsilon forms as 2005 Atlantic hurricane season comes to an end
0,"12-year-old girl dies after collapsing in school in Northamptonshire, England"
1,23 Tumblr Posts That Perfectly Explain Your Addiction To Tumblr
0,General Says Shoot Dealers in Afghanistan
0,A Clocker Is Waiting for a Derby Workout That Stops Time
0,More arrests from Cronulla riots
1,23 Christmas Pinterest Fails That Will Have You In Tears
0,Emerging Powers Prepare to Meet in Russia
1,17 Secrets Olive Garden Employees Will Never Tell
1,People Are Calling Bethenny Frankel A Racist After She Complained About Spanish-Speaking Employees At Kmart
0,A Hedge Fund Manager Wins and Moves On
0,Moderate Cleric Among 9 Killed in Pakistan Blasts
0,BP reports progress in oil spill cleanup
1,This Pup Broke A World Record And Proves Dogs Are Better Than Everyone
1,This Cancer Survivor Lost Her Leg But It Didn't Slow Her Down
0,Car bomb defused in central London
1,What It's Like To Date When You Can't Have Sex
0,Sri Lankan president declares victory over rebels
1,"Diwali, As Explained By My Brown Dad"
0,"Use Energy, Get Rich and Save the Planet"
0,Chief Executives Are Growing More Pessimistic
1,What Your Favorite Thanksgiving Food Says About You
1,18 Things People Who Love Christmas Do In December
0,African troops invade rebel-held island of Anjouan
1,23 Things Cats Don't Give A Shit About
0,Fierce Lobbying Greets Bill to Ease Unionizing
1,19 Times Canada Mercilessly Trolled The Rest Of The World On Tumblr
1,This One Question Will Tell You If You Are A Good Driver Or Not
1,What Your Co-Workers On Facebook Need To Hear
1,"FYI: ""Scream Queens"" Star Oliver Hudson Is The Hottest Dad On TV"
1,Will You Win A Grammy Or An Oscar
0,Web News Start-Up Has Its Eye on Texas
0,"23 killed, 36 injured by stampede at Sudanese stadium"
0,Boeing Executive Sees Recovery in Airline Traffic
0,7th Heaven television series comes to an end
1,17 Just Great Looking Dogs
0,"Iraq ballots to be audited due to voting ""anomalies"""
0,Colorado City Finds a Sales Pitch in a Rugby Pitch
1,"14 Times ""The Fresh Prince Of Bel-Air"" Was The Realest Show On TV"
0,FBI begins widespread financial probe of 26 firms
1,What Kind Of Animal Were You In A Past Life
1,15 Situations That Every Dog Owner Will Understand
0,Ex-Lobbyists in U.S. Case of Espionage Win a Round
0,"Dennis Ritchie, C programming language creator, dies aged 70"
1,21 Reasons A Woman Should Never Ever Have A Pit Bull
0,LaShawn Merritt and Sanya Richards Cruise to U.S. Titles in 400 meters
1,We Know Your Favorite Dog Breed Based On These Random Questions
1,This Is What It Looks Like To Get Tased In Slow Motion
0,Astronomers discover large exo-solar system
1,26 Times Chris Pratt Ruined Men For You In 2015
1,Can You Guess Which Letter Has Been Added
0,Time Does Not Heal All Wounds for Ailing Mets
1,13 Perfect Holiday Gifts For The Horror Fan In Your Life
0,Ford Motors posts US$2.7 billion annual profit
1,Welcome To The New Celebrity #IceBucketChallenge
0,"Vestas plant in Newport, England shuts down"
1,11 Quotes About Friendship That Will Make You Text Your BFF
0,Tropical Storm Carlos re-strengthens over the Pacific
1,Terrifying Fact: NSYNC Is Now 20 Years Old
0,Australian opposition may oppose plain packaging on cigarettes
1,How King Bach Dominated Vine
1,The Hardest 2000s Music Quiz You'll Ever Take
1,"11 Celebrities Wearing Iron Maiden T-Shirts, Ranked By How Likely It Is That They've Actually Listened To Iron Maiden"
1,These Gorgeous Moving Portraits Feature Your Favorite Actors Channeling Classic Movies
1,What Type Of Thot Are You
0,Woman robs pawn shop by swallowing stolen goods
0,Sony refreshes VAIO brand for business and entertainment
0,Caterpillars force temporary closure of Wisconsin state park
1,21 Secrets Chinese Restaurant Waiters Will Never Tell You
0,Boeing Employees Among Dead in Turkish Air Crash
0,Screen Actors Guild Fires Its Executive Director
0,Tax Change in Europe to Cut the Bill for Dinner
1,Try Not To Die Watching Channing Tatum Whisper Sweet Nothings To A Stranger
0,What Next for a French Meteor?
0,U.S. issues travel alert for Europe amidst fears of Al Qaeda attack
1,17 Trends All Men Should Avoid In 2016
0,Mr. Whipple Left It Out: Soft Is Rough on Forests
1,Which Early '00s Pop Diva Are You Based On Your Zodiac
0,Aunt hires prostitutes for 12-year-old nephew
1,"Let's Be Honest, GOP Candidate Lindsey Graham Has Dazzlingly Beautiful Eyes"
0,Johnson ousts Livingstone in London mayoral election
1,21 Desserts That Are As Delicious As They Are Colorful
0,Suspect in Ponzi Scheme Surrenders on Long Island
1,18 Badass Portraits From Glamour's Women Of The Year Awards
1,Are You More Whatsapp Or Viber
0,Australian parliamentary security officers allowed to address members as 'mates' again
1,Protomartyr's Joe Casey Isn't Too Old For Indie Rock
1,"The ""X-Files"" Cast On When Mulder Fell In Love With Scully"
1,10 Leftover Makeovers You Won't Believe
0,Sanctions on US products introduced by Brazil
0,"Nokia Plans 1,700 Job Cuts as Sales Slow"
0,"James Finds Help, but He Hardly Needs It"
1,19 Completely Ridiculous Rumours That Went Around Every School
1,Pick A Heart To Get A Positive Message Just For You
1,Here's How To Make Spinach Artichoke Garlic Bread
0,'Black box' found near crash site of Airblue flight
1,29 Ridiculously Stylish People From Toronto Fashion Week
1,18 Things You Say To Your Best Friend When You Get Drunk
0,Gay Festival in China Pushes Official Boundaries
1,This 7-Picture Test Will Reveal A True Difficulty You Have In Life
1,12 Everyday Activities That Might Actually Be Good For You
0,Washington Post Names 2 Managing Editors
1,What I Wish Someone Told Me About Having Sex
1,43 Pets Who Need A Home For Christmas
1,17 Misconceptions Sorority Girls Want To Set Straight
1,"33 Reasons We'll Miss The Hell Out Of ""Parks And Recreation"" In 2016"
1,17 People Who Are Absolutely Killing It At Dreamforce 2015
1,What's Your Favorite Boozy Holiday Drink
1,14 Retro Adverts That Would Never Be Published Today
0,"Numbers Say Jackie Robinson Was Bold, to Little Effect"
1,19 Pictures That Are Way Too Real After A Night Out
1,Everything Donald Trump Looked Like In 2015
0,"Despite passage of bailout bill, two US states may need loans"
1,A Little Girl Wore A GoPro On Her First Day Of Kindergarten And It's Too Many Feels
0,Woman dies when pet camel tries to mate with her
1,"How Well Do You Remember The ""One Tree Hill"" Finale"
0,Peacekeepers in Somalia Are Killed by Islamists
0,Interview: Wikinewsie Kim Bruning discusses Wikimania
0,Zimababwe Zanu-PF party dismisses Tsvangirai unity boycott
0,Questions raised over Mosquito device ahead of New South Wales trial
1,23 Hilarious Memes That Explain Greek Life At A Black School
0,"22 killed as heavy rain hits Panzhihua, China"
1,11 Greeting Cards We Desperately Need For Canadian Thanksgiving
0,Oasis star Noel Gallagher assaulted on stage in Toronto
0,US President Barack Obama speaks at memorial for Arizona shooting victims
0,Romania to adopt euro between 2012 and 2014
1,21 Times The Mall Failed So Hard It Just Failed
1,Tell Us Your Most Embarrassing Teenage Moment
0,"Red Cross member abducted in Darfur, Sudan"
1,Kristen Bell And Dax Shepard Dancing Through Africa Will Restore Your Faith In Love
1,"21 Confessions From The Biggest ""Gilmore Girls"" Fans In The World"
1,12 Amazing YA Books By Latino Authors You Wont Be Able To Put Down
1,27 Gifts Every Book Lover Should Ask For This Year
1,55 Thoughts Everyone Has While Eating At Olive Garden
0,US temperatures edge upward following brutal winter storm
0,"British Unions, Angry Over Use of Foreign Workers, Stage Walkouts"
0,Reverberations as Door Slams on Hope of Change
1,15 Charts That'll Only Mean Something To People Who Love Running
0,"Buffalo, New York man shot in head, run over by shooter's car"
0,Former S. Korean President Apologizes for Scandal
1,This Woman Had The Best Response When Her Husband Asked What Was On Her Mind
1,Which Golden Globe Red Carpet Look Are You Based On Your Zodiac Sign
1,This Man Surprised His Wife With The White Christmas Of Her Dreams
0,Las Vegas 'chili finger' woman has history of lawsuits
0,"Cat in Rhode Island, USA nursing home 'senses death'"
0,FDA says Coca-Cola's Diet Coke Plus is misbranded
1,These Two Men Had A Perfect Solution To Their Pub Flooding
0,Israeli PM Sharon suffers 'mild stroke'
1,16 Times Ralph Wiggum Perfectly Embodied The Dating Struggle
1,This Color Test Will Determine Your Go-To Sex Move
0,AFL provides insufficient support for European leagues: Germany
0,U.S. military denies reports helicopter opened fire on Libyan civilians during rescue mission
0,Plaintiffs and Amazon propose settlement to Kindle deletion lawsuit
1,"The Catalina Wine Mixer From ""Step Brothers"" Is Actually Happening"
0,13 Firms That Received Bailout Money Owe Back Taxes
0,U.S. Signals Willingness to Talks With Cuba
1,21 Tweets About Contacts Lenses That Will Make You Laugh Out Loud
0,Tour de France: Michael Rasmussen wins stage 16
1,23 Holiday Cocktails Guaranteed To Get You Merry And Bright
0,UBS Given a Short Window to Release Documents
1,We Tried To Get Away With Wearing Fancy Sweatpants Four Different Ways
0,Cricket: India defeat England in sixth one-day international
1,14 Ways Trays Can Make Your Space Feel More Put-Together
1,29 Tweets About Facebook That Will Make You Laugh Every Time
1,These People Tried To Figure Out Where Max And Ruby's Parents Are
1,What Happens When A Couple Reveals Their Sexual Fantasies To Each Other
0,"Wikinews at the Rugby: Sunshine Coast Stadium April 27, 2013"
1,Which Queen Are You Based On Your Zodiac Sign
1,31 Tweets About Exercise That Will Make You Laugh Out Loud
0,"In Britain and Spain, More Signs of Slowdown"
1,8 Songs That Will Make You See Kesha In A New Light
0,Japanese tourist travels through 37 countries on just $2
0,No debt yet: Iceland's President vetoes repayment of Icesave losses
1,31 Beautiful Dog Tattoos Every Dog Lover Will Appreciate
0,Obama budget calls for record US deficit
0,US pressure group proposes covert attack on Iran
0,"Wikinews interviews Kent Mesplay, Green Party presidential candidate"
0,Garuda Indonesia Flight 200 pilot forced to resign
0,Senator Arlen Specter challenges President Bush
0,UK transport firm Metronet facing administration
0,Pegasus rocket launches C/NOFS satellite
1,8 Ways To Use Bi Invisibility To Your Advantage
0,New 'failed states index' report published
0,Waking Up From the N.B.A. Draft and Wimbledon
1,What Carb Are You
1,18 Resolutions You Won't Regret Making In 2016
0,C-17 crashes near air force base in Alaska
0,"Over 100 people die in stampede at Hindu temple near Jodhpur, India"
1,How Do You Take Care Of Yourself While Training For A Race
0,Crown Prince Sultan of Saudi Arabia dies
0,George Zimmerman found not guilty in Trayvon Martin case
1,19 Christmas Eve Traditions You Probably Didn't Know About
1,These Are The Best Products You Can Get With Your Sephora Gift Card
1,"Kanye West Perfectly Responded To Drake's ""Nice Pool"" Lyric"
1,"Jessie J Sang Little Mermaid's ""Part Of Your World"" And It's Insane"
0,Guyana president's libel case heard in court
0,Albanian girl murdered in tangle of crime
0,Fußball-Bundesliga 2007–08: Matchday 2 roundup
1,Things You're Absolutely Sure Of Until You Have Kids
0,Police raid filesharing resources
1,Which Famous Vampire Should You Date Based On Your Zodiac Sign
1,"The Sexual Tension Is Real In The New ""Batman V Superman"" Teaser"
0,2nd Custody Hearing Is Canceled as Jackson Relatives Hold Talks
1,17 Things Only '00s Disney Kids Will Remember
0,British poet Peter Porter dies at age 81
1,If Beauty Product Ads Were Actually Honest
1,35 Things You're Never Going To Get For Christmas Again
1,We Know If You're Single Based On Random Questions
1,Dog Heroically Escapes From Vet And Takes Vet With Him
1,Japanese Women Try On Geisha Halloween Costumes
1,Burning Man Experience Generator
0,Finnish police isolate ports in Helsinki
0,"Bombs kill US Marines, civillians in Iraq"
1,What Kind Of Pop-Tart Matches Your Personality
0,Space Shuttle Discovery launch scheduled for Tuesday
0,"Europe to Buy 30,000 Tons of Surplus Butter"
1,Would You Smooch These Animals
0,"Imperial College London geology students fined in China for ""illegal map-making"""
1,These Are Makeup Struggles Every Girl Understands
1,"What Percentage Kardashian Are You, Based On 3 Questions"
0,'Mobile phone dermatitis' linked to nickel deposits
1,16 Non-Canadians Who Have The Hots For Canada's Next Prime Minister
1,24 Cats Who Have No Idea What This World Is About
1,23 Signs That Cannot Be Trusted
1,A New Study Shows 92% Of College Students Prefer To Read Paper Books
0,Man shot after attempting to drive through US-Mexico border
0,NSW Supreme Court upholds non-publication order for lawsuit filed against Australia's richest person
0,Southern California auto maker announces fully-electric sedan
1,"19 Tumblr Posts About ""Harry Potter"" That Will Make Your Day"
1,What New Song Should You Play On Repeat This Weekend
1,7 Really Delicious Dinners For The Week
1,Here's A Preview Of The New MAC Makeup Designed By A Bunch Of Badass Women
1,Which Bollywood Actor Should You Marry
1,Can You Pass This Sunday School Test For Children
0,South Dakota tower demolition botched
1,Which Actor Should Be Your Leading Man
1,18 Things That Happen When You're Way Younger Than Your Siblings
1,The Windows 98 Screensavers Ranked From Worst To Best
0,Next Shuttle flight delayed to next year; ISS crew begin spacewalk
1,"The 28 Most WTF, LOL, And OMG Viral Videos Of 2015"
1,This Sorting Hat Quiz Tells You The House You Definitely Wouldn't Be In
0,"Married couple die after being hit by car in Largs, Scotland"
0,Nuclear leaks after Japan quake are worse than first reported
1,"My Long, Exhausting Summer Of Street Harassment Is Over"
0,"For Peugeot Chief, History Repeats Itself"
1,19 Hilarious Tweets About Having To Sit At The Kids' Table On Thanksgiving
1,This Mumbai Musician's New Song Will Be Your New Favourite Jam
0,Mass industrial walkouts in UK
1,Which Type Of Swearer Are You
0,King of Bahrain declares state of emergency
0,"On Foreign Policy, Obama Shifts, but Only a Bit"
0,"Belgian king swears in PM Van Rompuy, cabinet"
0,Jobless Rate Surpasses 10% in 15 States and D.C.
1,18 Thoughts Everyone Has Before A Hookup
1,If Beauty Ads Only Used The Actual Product Being Advertised
1,19 Pictures That Sum Up Life When You're Bad At Math
0,"For Obama, Choice Is Unified Palestinian Government or an Isolated Hamas"
1,33 Pictures From The Glory Days Of The Warped Tour
1,"What Are The Funniest Cold Opens From ""The Office"""
1,"Director Of Adele's ""Hello"" Video Said The Reaction To Her Flip Phone ""Drives Me Crazy"""
1,Can You Look At These Wedding Photos Without Yelling OMG WTF NO
1,"The Cast Of ""Parks And Rec"" In Their First Episode Vs. Their Last Episode"
0,Jailed American journalist in Iran sentenced to eight years in prison
1,19 Reasons Straight Women Should Stay Single Forever
1,BFWKND
0,Internet Explorer 7 beta released to the public
1,When You're Single AF
0,Student-Athletes Protected? Insurance Fine Print Matters
1,24 Photos That Prove The Rock Won 2015
1,Which TV Character Should You Be For Halloween This Year
1,"20 Of The Most Overcrowded, Anxiety-Inducing Places In The World"
1,"106 ""Star Wars"" Quotes That Make Perfect Instagram Captions"
0,Survey Reveals Broad Support for President
1,Calvin Harris Shared His Shirtless Cycling On Snapchat
1,Are You More Like Dannii Or Kylie Minogue
1,10 Boozy Drinks For People Who Love Candy
1,"Can You Match The Quote To The ""Grey's Anatomy"" Character"
0,American actor Morgan Freeman in serious condition after car accident
0,Downturn Hurts Expectations in Portland
0,"Identifying the Bird, When Not Much Bird Is Left"
0,"For Obama Abroad, Moscow Is a Special Case"
0,Hedge Funds Agree to Return $235 Million in Madoff Case
1,15 Confessions From People Who Literally Think That Sex Is The Best Workout
0,Iranian Baha'i dies in jail
1,These Five Questions Will Determine When You're Getting Married
1,22 Pictures That Perfectly Sum Up Every Single Thanksgiving
0,Video Slur Puts Prince Harry Back in Headlines
0,"Explosion, fire temporarily halts cereal production at General Mills plant"
1,We Gave These Americans Euros And They Were Confused
0,"Four families left homeless after apartment fire in Buffalo, New York"
1,15 Of The Best Ways To Actually Dress Your Body Type
1,If Disney Movies Were Blaxploitation Films
1,"The 17 Funniest Tweets About ""Harry Potter"" In 2015"
1,17 Celebs Who Prove Long Hair Isn't The Only Way
0,Cyprus to charge five over 2005 plane crash that killed 121
0,Florida High School Senior to Try for Fifth Consecutive No-Hitter
1,16 Honest Confessions From People Wearing Purity Rings
0,India's Jet Airways posts biggest quarterly loss in three years
0,Explosions at 2 Hotels in Indonesia Kill at Least 9
0,Chief of Independent News and Media to Resign
1,The One Way To Get A Phone Number
0,Musical Show of Unity Upsets Many in Israel
0,Would-Be Olympic Protester Sentenced to 3 Years in Prison
1,Meet The Girl Who Buttchugged Cough Syrup
0,"Richard becomes a hurricane, threatens Belize"
0,Sudanese Army claims to have killed 300 Darfur rebels in clashes
0,Ugandan president distances himself from anti-gay bill
0,G.M. to Announce 3rd New Plan in Last 4 Months
1,This Insane Website Will Fulfill All Your Christmas Wishes
0,São Paulo crowned Copa Libertadores champions
1,Stephen Colbert Nails Why Social Media Support For Paris Matters
1,In Defense Of Oatmeal Raisin Cookies
0,Could an unmarked grave in Winchester contain the remains of King Alfred?
1,This Woman Is Extreme Knitting Giant Blankets And They Look So Cosy
1,This Is What Happens When Mexicans Try On Stereotypical Halloween Costumes
1,45 Things I Wish Someone Had Told Me About Antidepressants
0,Ex-Fund Manager Has 2 Years Added to Sentence for Fleeing
