0,New search engine to search inside Wikipedia
0,Ralph Nader calls out Democrats for financial bailout
0,Minnesota considers open-format state documents
0,California Supreme Court defers ruling on same-sex marriage ban
1,28 Vines That Will Remind You Life Is Not (Always) Terrible
1,Can You Guess The Celebrity Just By Their Eyeliner
1,12 Waffle Maker Snacks You Should Make Immediately
1,17 Times Social Media Saved The Day In 2015
0,Donald Brown Is N.F.L. Prospect With More on His Mind Than the Draft
1,"17 Foods Guaranteed To Excite Any ""Star Wars"" Fan"
1,"This ""Toy Car"" Is Better Than My Real Car"
0,BBC to play 'four to five seconds' of Thatcher protest song
1,"Natalie Dormer Auditioned For A Completely Different Role On ""Game Of Thrones"""
0,Fiona Donnison jailed for murdering her children in UK
0,Stabbing at Massachusetts high school leaves one dead
0,Somali Minister Killed in Bombing
0,"Obama, at Caterpillar Plant, Lobbies for Stimulus Package"
1,Why You Should Always Google Your Dates
0,Disney to Start a Cable Channel for Boys
1,13 Art History Hotties You'll Want To Fuck
1,14 Confessions From Single Dads That Are Heartwarming And Heartbreaking
0,Chinese Golfer Makes a Name for Herself on L.P.G.A. Tour
0,Credit Card Industry Aims to Profit From Sterling Payers
1,Amy Poehler's Biggest Fear Is Making J-Lo Mad
0,Iraq Sentences 28 Cultists to Death for Attacks on Pilgrims
0,"Chicago man pleads ""not guilty"" to Mumbai attack plot charges"
1,17 Easy Weeknight Pastas That Don't Have Any Dairy
0,"Hillary Clinton attends grand opening of the Erie Canal Harbor in Buffalo, New York"
1,34 Hilarious Nicknames Chinese People Have Given Celebrities
0,Prodi wins vote of confidence
1,The Pros And Cons Of Being A Student In Your Thirties
1,We Need To Talk About How Cute Royalty Brown Is
1,21 Delicious Ways To Celebrate Mardi Gras
0,Two-and-a-half tonnes of marijuana destroyed in Afghan school
1,We Know Your Pet Peeve Based On Your Favorite BuzzFeed Badge
1,"31 Times ""Scream Queens"" Perfectly Described A Night Out With Friends"
0,Up to 31 women sue UK police force over rapist officer
1,U.S. Navy Vets Played Battleship And It Wasn't Pretty
1,Is Your Boyfriend Goofus Or Gallant
1,Zendaya's Thoughts On Body Image And Bullying Are Super Inspirational
1,"OMG, Yes, You Can Totally Make Your Hair Glow-In-The-Dark Now"
0,"US Marine killed after vehicle capsizes, sinks in Oceanside Harbor, California"
0,At least eight dead after drone strikes in Pakistan
0,"One dead, eighteen injured in Florida lightning strike"
1,This Photographer Takes Discarded Shopping Lists And Turns Them Into Freaky Recipes
1,18 Pictures Everyone Who Loves Spilling The Tea Will Understand
0,African refugees allege forced labour by Turkish police
1,An Ode To Yolanda Foster's Malibu Mansion
0,SADC calls for transparent Mozambique elections
1,Amy Schumer Thanking Her Smokey Eye At The Emmys Is All Of Us
0,Netanyahu Gains in Bid to Be Israeli Premier
0,Growing Need for Medicaid Strains States
0,English Club Is Accused of Helping Bitter Enemy
1,Which Relative Will Be Your Nemesis Over The Holidays
0,Magnitude 6.3 earthquake hits New Zealand's South Island; dozens dead
0,Aidan Burley MP sacked following Nazi pics furore
0,North Korea prepared for 'sacred' nuclear war with South
1,"Sit Back, Relax, And Watch All My Favorite Vines From 2015"
0,More troops for southern Thailand troubles
1,Bearded Women Kiss Their Boyfriends To Show Men How It Feels To Kiss A Beard
1,"Priyanka Chopra's Prep For The Red Carpet Was To Eat A Burger, And It's Amazing"
1,Would You Rather?: Hot Guys Then Vs. Now
0,Tamils Now Languish in Sri Lanka Camps
0,UK policeman convicted of murdering WPC fiancée who died after staged car crash
0,Science of champagne bubbles explained
1,This Genius iPhone Trick Will Help You Clear Your Entire Inbox
1,What Type Of Fall Sweater Are You
1,Your Horoscope For The Week Of November 30
1,16 Delightful Pictures Of Stormtroopers Enjoying Their Day Off
0,Landslide causes train derailment in Italy; nine dead
0,US and France to work together for new Iran sanctions
0,Possible eruption at Ruapehu Volcano in New Zealand
1,24 Disappointing White Elephant Gifts People Have Actually Ended Up With
0,"At Davos Forum, Russia and China Blame Capitalists for Economic Crisis"
0,Alleged rapist files charges against victim in Sweden on HIV infection grounds
0,A.N.C. Closing in on Victory in South African Vote
1,This Physicist Shot Himself Underwater To See What Would Happen
1,17 Reactions Everyone Will Recognize During Engagement Season
1,106 Unexpectedly Awesome Songs For Every Moment Of Your Wedding Day
1,"10 Hilarious Rounds Of ""Never Have I Ever"" With Ice Cube And Kevin Hart"
1,11 Christmas Cards Only Cubans Would Send
0,Arms Given by U.S. to Afghan Forces May Be Leaking to Taliban
1,25 Mouthwatering Ways To Use Maple Syrup
0,Air France jet with 228 on board goes missing
1,"31 ""Friends"" Jokes That Never Get Old"
0,US Secretary Rice responds to European enquiries on alleged CIA prisons
1,We Invaded Three Queer Lady Couple's Apartments To See What It's Like After The U-Haul
1,"If You Love Drake's ""Hotline Bling"" Video, You're Probably Gonna Love This Guy's Stuff"
1,"Go Home Everyone, Sir Patrick Stewart Won 2015"
0,Carwashes Accused of Labor Violations
1,29 Hilarious Fake Books About Social Media That Need To Exist
0,All passengers survive Toronto plane crash
1,18 Times Khloe Kardashian Was The Coolest Aunt In The World
1,How Much Do You Really Know About Vance Joy
0,Russia expels four UK diplomats
0,Guatemalan football executive shot dead after team meeting
1,23 Insane Things Women Have Actually Found In Their Boob Crack
1,Zendaya Is Rocking A Full-On Mullet At The Grammys
1,13 Terrible Emails My Father Sent To Me In 2015
1,How Bajirao Mastani's Flaws Make It A Perfect Tribute To Great Indian Storytelling
0,"Iraq on verge of civil war, head of Arab league fears"
1,This Is What Happens When A Blizzard Strikes On Your Wedding Day
1,What's The Worst Gift You've Gotten
1,13 Indians Told Us About Their Worst Experiences With Moral Policing In Colleges
1,"13 Marvel ""What If"" Stories That Totally Came True"
1,"Lil Bub Is Announcing Her First Album Right Here, Right Now"
0,"Urging Freedoms, Obama Chides Zimbabwe Leader"
0,The Tricky Question of Whether to Spend or Save
0,Forest fires burn on in Greece; death toll nears 50
0,"As Boom Town Busts, a Brief Political Movement Fades Away"
1,"This ""Wicked"" Proposal Will Reignite Your Obsession With The Show"
0,"For Two Israeli Tennis Players, Focus Returns to Sports, Not Politics"
0,Experts Watch for Signs Obama Will Move Appeals Courts to the Left
1,24 Songs You Sweatily Made Out To In 2005
1,10 Celebrities You Might Not Know Were Muslim
0,"Stocks End Mixed, Giving Top Indexes Weekly Loss"
1,18 Pictures That Prove Cosmo And Wanda Are Real
1,Can You Actually Name These 12 Classic Cocktails
0,Rachel Rice wins Big Brother UK's 2008 series
1,Can You Last 30 Seconds In A Post Full Of Pictures Of Zits Being Popped
0,West Is Told to Expect Water Shortfalls
0,Former communist leader Hua Guofeng dies age 87
0,"In the Andes, a Toxic Site Also Provides a Livelihood"
1,What Girls Do On Instagram
0,A Night Frozen in Time
1,14 Women Reveal Why They Faked Being Pregnant
1,"Hair Salons Are Now Offering ""Quiet Chairs"" For People Who Hate Talking"
0,The Pitfalls of the Public Option in Health Care
1,12 Presidential Candidates And Their Dog Twins
1,21 Photos Of Green Mangoes That'll Make You Drool
0,Early puberty for US girls raises health risk
0,Lewis Hamilton wins 2008 Australian Grand Prix
1,Can You Identify These Disney Movies Based On A Screenshot
0,No-fly zone demanded by Syrian protesters
0,Independent Member of Australian Parliament calls for better indigenous policy
1,A Chair Lift Broke Down In Banff And Skiers Had To Rappel Down Ropes
0,Harvard Slows Its Growth in a Boston Neighborhood
0,Two women in North Carolina arrested for allegedly using Family Dollar variety store as marijuana ring
1,We Know Your Favorite Animal Based On Your Favorite Colors
0,Kentucky Star Forges Identity With Every Point
1,7 Struggles All People With Common Names Understand
1,21 Tweets That Are Way Too Funny For Anyone With A Pregnant Sister
0,"Pennsylvania lost 41,000 jobs in February, a 13-year high"
0,Typhoon Melor on path towards Japan
0,Clinton Reassures Mexico About Its Image
0,"Acquired in J. J. Putz Trade, Sean Green Also Seen as Valuable to Mets"
1,This Stunning Photo Captured The Split Second Hot Tea Froze In Mid-Air
1,How Monday Was Your Monday
1,The Year Of The Snail
1,"This Couple Performed The ""Up"" Theme For Their 60th Anniversary"
1,21 Tweets About Getting Old That Are Funny Because They're True
0,Jobs Data Gives Shares a Lift
0,Obama Again Raises Estimate of Jobs His Stimulus Plan Will Create or Save
0,"Elevating Science, Elevating Democracy"
1,I Lived Without A Phone For One Week And Here's What I Learned
0,Resurgent Egypt Takes Aim at  U.S. in Confederations Cup
0,Friendly fire kills three UK soldiers in Afghanistan
0,Scientists say genetic building blocks are from out of this world
0,Magic Seizes a Redeeming Series Lead Over the Cavs
1,People Try To Define Yiddish Words
1,11 Gloriously Festive Photos Of London At Christmas Throughout History
1,11 Adorable Dogs Who Don't Want You To Burst Any Crackers This Diwali
0,"Small explosion investigated in Times Square, New York"
1,What Is Your Booze IQ
0,6.8 earthquake strikes off coast of Colombia
1,Can You Pick The Right Guy
1,12 Recipes That Made Your Life Complete In 2015
0,Bell Canada to discontinue beaver mascots
1,Serious Question: How Many Pairs Of Basketball Shorts Does Adam Sandler Own
1,11 Ingenious Yet Completely Illegal Italian Inventions
1,17 People Who Have Literally No Idea What They're Getting For Christmas
0,RU486 debate complicates with amendments posed in Australian House of Representatives
0,"Egypt anti-government protests continue, Internet shut down"
0,Reticent Justice Opens Up to a Group of Students
1,Pigskin A Blanket: NFL Week 15 Picks
1,13 Lies Your Depression Is Telling You
0,BBC launches the Creative Archive
1,"Hedley Gives Us An Exclusive Stripped Down Cover Of Their Song ""Hello"""
1,18 Reasons My Dad Is Basically Ron Swanson In Disguise
0,Israelis United on Gaza War as Censure Rises Abroad
1,17 Things That Are Basically A Workout
1,Kerry Washington Said It's Important To Address Abortion On TV
0,"Indigenous Australians told to ""wash for fuel"""
1,"You Aren't Able To Listen To Adele's ""25"" On Apple Music Or Spotify"
0,One million protest against Spanish abortion liberalisation
1,Coming Out: 1st Time Vs. 101st Time
1,This Couple Revealed Their Baby's Gender In The Most Epic Way Possible
0,Freddie Starr arrested as part of Savile child sex inquiry
1,"This Artist Painted Lin-Manuel Miranda's ""Hamilton"" On A Ten-Dollar Bill"
1,"I Went To A Black College Because Of ""A Different World"""
0,"Border agent killed in Arizona, four in custody"
1,I Carried Around A Sack Of Flour For A Week To See If I Would Be A Good Parent
0,Governor of Illinois Calls for Increase in Income Tax
1,Television's First Asian-American Action Hero Is A Letdown
1,11 Things That Will Definitely Happen When Donald Trump Is President
1,How This Writer Learned To Cope With His Stepbrother's Schizophrenia
1,17 People Who Probably Didn't Get Their Money's Worth
0,"Replicating Charm, but Losing Old Yankee Stadium Advantage"
0,Car entrapped by ice in Halifax
1,19 People Confess Their College Regrets
0,A Shelter That Could Start a Stampede
1,Can You Guess The Celebrity By Their First Tweet
1,24 Photos That Will Make You Wish You Went To Mermaid School
1,17 Blind Dogs Who Will Make Your Day A Lil' Bit Better
1,Thierry Henry Reacted Brilliantly To Brendan Rodgers Getting Sacked And It Became A Huge Meme
0,Many Gulls Die After Oil Spills Into River in Ohio
0,Woman gives birth on New Jersey PATH train
0,Quake Fears Stall Energy Extraction Project
1,"The Montreal Canadiens Sang A Beautifully Bad Version Of ""Let It Go"""
1,"A Man Named ""Phuc Dat Bich"" Posted His Passport Photo To Facebook After Being Banned Multiple Times"
1,Can You Match The Song To The All Time Low Album
0,Holdouts for Humble Bulb Defy a Government Phase-Out
0,British Regulator Criticizes Culture of Bank Boards
1,23 Insanely Relatable Stages Of Partying As An Introvert
1,17 Signs You May Actually Be Addicted To Hajmola
1,Hook Is Actually A Very Messed Up Movie
0,NATO to expand Afghanistan presence
0,Freddie Mac Posts Loss of $23.9 Billion
1,10 Insanely Delicious Smoothies To Fuel Your Trip To The Gym
1,"The First ""Shadowhunters"" Footage Is Seriously Cool"
0,"With Explosions of Color, Tibetan Art Flourishes"
1,27 Times Nadia Aboulhosn Was Right About Everything
0,Music promoter Mean Fiddler sold for almost £38m
1,27 School-Themed Wedding Ideas To Satisfy Your Inner Nerd
1,"This ""Hunger Games"" Interpretation Will Change The Way You See The Mockingjay"
0,Tropical Storm Danielle forms in Atlantic Ocean
0,"Far From Whole, Iraq Museum That Was Looted Reopens"
1,Struggles Of A Dogless Dog Lover
1,18 Random Good Deeds That Will Restore Your Faith In Humanity
1,What Your Friends Say About You
0,25 Militants Are Killed in Attack in Pakistan
0,Egyptian train crash at level crossing leaves dozens dead
1,Dads Failing At Riding Hoverboards Ruined Christmas For Everyone
0,Times Co. May Include 2nd Paper in Globe Sale
1,30 Online Shops Based In The Northeast You Should Be Shopping At
0,"Ryanair sack, sue pilot over participation in safety documentary"
0,Australian judge delivers verdict on burqas in court
1,"Here's How To Actually Heal Your Dry, Chapped Lips"
0,Federal government begins employing strategies to repair New Orleans
0,Formula One Is Running Its Final Race at the Legendary Silverstone Track
0,Aussies ignore flag ban at Big Day Out festival
0,Toronto transit union threatens strike for Monday
0,Peace of Mind From the Whiff of Bleach
0,Zimbabwean cargo plane crashes in Shanghai; three dead
1,"Everyone Lost Their Minds About New ""Gilmore Girls"" Episodes Officially Coming To Netflix"
1,22 Things That Seemed Cool As A Kid That Actually Suck As An Adult
0,"In Germany, an Image of Haplessness"
1,"Aziz Ansari's Parents Are Simply Amazing In ""Master Of None"""
0,Some Find Hope for a Shift in Drug Policy
1,11 Stress Texts You Only Send During Finals Week
1,Here's What Happens When Tomboys Wear Dresses For A Week
0,Building collapses in Mecca at eve of Hajj pillgrimage
1,This Is The Only Spinach And Artichoke Dip You Need In Your Life
1,What Song Helps Get You Motivated
1,Day 7 Of BuzzFeed's 7-Day Clean Eating Challenge
0,Oklahoma Goes for a Triple
1,14 Ways Doing Theater As A Kid Can Help You As An Adult
0,Baghdad Is Shaken by a Series of Bombs
1,24 Beautiful Little Phrases To Tattoo On Yourself
0,Four killed in sectarian clashes in Beirut
0,Obama Defends Agenda as More Than Recession
1,A Stingray Photobombed A Couple's Proposal And It's Adorable
1,5 People Reveal What Happens Behind The Perfect Instagram
1,John Boyega Was Actually The Cutest Part Of The BAFTAs
0,"Twelve-year-old schoolboy stabbed, dies in Brisbane, Australia"
1,You've Been Making Papas Rellenas Wrong Your Entire Life
1,21 Photos People Who Skipped Science Won't Understand
0,"'Suspicious package' causes closure of busy street in Buffalo, New York"
1,I Realised My Dream When I Turned My House Into Hogwarts
0,US First Lady undergoes neck surgery
0,Canadians may elect Senate
0,Death of Michael Jackson causes last minute changes to films and dramas
0,Cairo blast kills 3
1,22 Struggles Every Small Girl With Big Feet Will Understand
0,"Eight dead and two missing after cargo ship fire in Kaliningrad, Russia"
1,The New York Times Asked Readers If They Could Kill Baby Hitler And People Are Freaking The Fuck Out
0,Democrats Have Qualms Over War in Afghanistan
1,How Well Do You Remember These '90s Premier League Goalkeepers
1,Watch People Struggle Trying To Guess Urban Dictionary Terms
0,Approval by a Blogger May Please a Sponsor
1,Emily Blunt And John Krasinski Are Officially Having Another Baby
0,Speedskating Provided Marsicano a Refuge From Bullying and Depression
1,These Billboards In Wyoming Might Make You Want To Get Tested
1,31 Hilarious Tweets About Eating Healthy That Will Get You Every Time
1,18 Breathtaking Mexican Treats That Will Make You Drool Uncontrollably
1,This Doctor Can Quiet A Crying Baby In Seconds And His Trick Is Totally Mind-Blowing
0,Afghan Villagers Describe Chaos of U.S. Strikes
0,UK PM pledges aid for Myanmar
1,17 Things Kylie Jenner Did Three Years Ago That She'd Never Do Now
0,The Many Sources Governing Warfare
0,Court rejects Polanski bid to have child sex charges dismissed
0,At least 71 deaths in Mexico 'likely linked' to swine flu outbreak
0,Sunshine Coast Council ratifies McDonald's development rejection
1,What Kind Of Animal Is On Niall's Shirt In The New One Direction Music Video
1,George Clooney Drinking A Cup Of Coffee Will Sexually Awaken You
1,This Bride Baked A Life-Sized Wedding Cake Of Herself And Her Groom
0,Red Cresent workers kidnapped as Blair visits Iraq
0,"Somali pirates release Greek ship, 19 sailors"
1,14 Songs From The Early 2000s That Are Now Modern Day Christmas Classics
1,Hat Vs. Hat
0,Warner Brothers Plans to Cut 800 Jobs
0,Ford offers US$78 million for Romanian auto plant
0,Rep. Waxman: Karl Rove violated non-disclosure agreement
1,18 Vegan Mac 'N' Cheese Recipes That'll Make You Drool
0,Lightning storm moves through Southern California
1,BuzzFeed Crossword: Don't Get Emotional
0,London bombing death toll rises to 'more than 50'
1,We Know What Type Of Person You Are Based On When You Poop
1,Why We Should All Team Up And Fight Santa
0,Five dead in Calgary murder-suicide
0,Serb pilots defend colleague in Air India Express disaster
0,"After 9 months, Belgian coalition delivers government"
0,Falling Revenues Threaten Rebuilding in Iraq
1,9 Things TV And Movies Actually Have To Understand About Latinos In 2016
1,This Color Test Will Determine Your Ideal Sex Position
0,Thirty die in car accidents during Bicentennial of Chile celebrations
0,"Surfer dies at beach in Pichilemu, Chile"
0,"Earthquake strikes Melbourne, no reports of injuries"
1,How Well Do You Remember These PlayStation Games
0,"Diamond Sales, and Prices, Plunge in Downturn"
1,21 Insanely Hot Dishes Guaranteed To Spice Up Your Life
1,Here's How To Actually Get Fit When You're A College Student
0,Mugabe: There will be an election in Zimbabwe
1,"Are You More Elle Woods From ""Legally Blonde"" Or Andy Sachs From ""The Devil Wears Prada"""
1,How Well Do You Remember Ross's List Of Reasons Not To Date Rachel
1,22 Secrets Au Pairs Will Never Reveal
1,"The Hard Lessons Catherine Hardwicke Learned From ""Twilight"""
1,We Need To Talk About Brazil
0,Politician denies claims he smoked cannabis while ambassador
1,Do You Recognize These 2015 Chart Toppers
0,Falling Sales Cloud Book Industry Meeting
0,Shin wins Singapore HSBC Womens Golf Classic
1,Taraji P. Henson Responded Perfectly When Her Golden Globes Speech Was Almost Cut Short
1,Here's What You Need To Know About Getting Popular Tattoos
1,Which Disney Sidekick Are You Based On Your Zodiac Sign
1,"Which ""Finding Nemo"" Character Are You Based On Your Personality"
1,13 Charts That Are Way Too Real For Bisexual Women
1,19 Things People Who Aren't Naturally Loud Will Never Understand
1,16 Very Rude Texts Your Chronic Pain Would Send You
1,The Internet Can't Stop Memeing Randeep Hooda After His Massive Weight Loss
0,At least 55 killed by Hurricane Katrina; serious flooding across affected region
1,Would You Make It In The Keating Five
1,18 Fixes To Small Problems That Are Annoying AF
1,This Guy Used OkCupid To Find His Worst Enemy And Went On A Date With Her
1,13 New Ways To Style Your Hair In 2016 That Are Actually Pretty
0,Landless Workers Movement marches to Brasilia in protest
1,Can You Match The Selena Gomez Music Video To Its YouTube Comment
0,Bacterial meningitis possibly spread on AirTran flight
0,Daniel Craig to be new James Bond
0,"Two dead as earthquake strikes Kütahya, Turkey"
0,Abkhazia to close border with Georgia following bomb blasts
1,9 Images Of Donald Trump Photoshopped Into ~Millennial Situations~
1,"How Well Do You Remember Clark Griswold's Rant In ""Christmas Vacation?"""
0,Canadian foreign affairs minister resigns amid controversy
1,What Will Your New Year's Eve Be Like
0,"In Weekly Address, Obama Hails Stimulus and Announces Plans to Cut Deficit"
1,18 Newborn Puppies Ready To Take On The World
0,"In One Church, Confession Makes a Comeback"
0,"Cricket: Caloundra defeat Glasshouse in Sunshine Coast, Queensland division one limited overs final"
1,17 Ingenious Tricks Every Lazy Person Should Know
0,Detroit Courts Vie to Host Potential Bankruptcies
0,Soccer in the U.S. Is Still Waiting for Its Moment
0,Formula One Threatens to Sue Teams Seceding Over Cost Cap
0,India wraps up Test cricket series win in England
0,Al-Qaeda says another bin Laden tape to be released
1,Are You Player 1 Or Player 2
1,23 Things You'll Only Get If You're Obsessed With Cheese
1,"Do You Really Know The Words To ""Breaking Free"""
1,How Well Do You See Color
0,"Rail tunnel collapses at Gerrards Cross, UK"
0,"Accounts, People, Miscellany"
0,Sotomayor Selection Creates a Puff of Pride
0,Chechnyan president sues Russian activist over murder claim
1,10 Brilliant Pieces Of Life Advice From Ryan Reynolds To His Fans
1,"22 ""Legend Of Zelda"" Tattoos That Will Blow You Away"
0,UN: World hunger at all-time high due to economic slowdown
1,31 Two-Person Costumes Guaranteed To Up Your Halloween Game
1,"Jennifer Lawrence Wore A Jacket That Says ""Perv"""
0,Trial Opens in Germany for 4 Suspected of Plotting Bombings
1,I Went To The IRL Derek Zoolander Center And It Was Ridiculously Cool
0,"Cool and Calm, Glover Collects the Trophy at the U.S. Open"
1,This Gift List Hack Might Actually Save Your Holiday
0,"UConn Nears Perfection, but Has Room to Improve"
0,"Cleveland, Ohio clinic performs US's first face transplant"
1,"The First Trailer For ""Captain America: Civil War"" Is Finally Here To Destroy You"
1,17 Times Tumblr Made Us Laugh About Thanksgiving
0,Fires out at the Hertfordshire Oil Storage Terminal
1,Kylie Jenner Wears Shiny Ass-Less Pants In New Interview Magazine Photo Shoot
0,Housing Starts Rise an Unexpected 3.6%
0,Former eBay Executive Tries a New Bid. This One Is Political.
1,What Is Your Family's Weirdest Christmas Tradition
1,20 Ridiculously Awesome Pieces Of Furniture You Wish You Could Afford
0,Shares Slide on Worries Over Rising Interest Rates
1,Jimmy Fallon Keeps On Getting Injured
1,Kimchi Quesadillas
0,Wyeth Deal May Slow Pfizer Biotech Acquisitions
0,Automakers Seek $14 Billion More in Aid
0,Wikinews interviews U.S. Libertarian presidential candidate James Burns
0,EU ban on 75W bulbs comes into force
1,Are You More Like Queen Cersei Or Queen Margaery
1,"You Might Want To Rethink That Juice Cleanse, Because Science"
1,This Is Why Soy Milk Goes Funny In Your Coffee
0,Guard Assists Amid Flooding in W. Virginia
0,Offices Go Vacant at Fannie and Freddie
0,Parents Unable to Halt Cuts at Conserve School
0,Mobile phones to help fight AIDS in Africa
1,I Used The Crap Out Of The New iPhone 6s And This Is What Happened
0,Philippine shipwreck kills man; rescue boat also rescued
1,Bryce Dallas Howard Was Refreshingly Honest While Talking About How She Got Her Globes Dress At A Department Store
0,UK holds referendum on voting system
0,"Christina McHale, Ranked 374th, Is  Ready for Australian Open"
0,House of Lords approve same-sex marriage bill at third reading
0,US satellite radio provider Sirius unveils portable player
0,Mayor Aims to Add Spark to Flagging Sex Lives
1,Should I Delete Photos Of My Ex From Instagram
0,Google launches new blog search engine
0,Cindy Sheehan arrested inside Rayburn Building in Washington DC
1,"19 Times India Was Way, Way More Gender Progressive In 2015"
0,ICANN approves .xxx domain for pornography
0,"With High-Speed Camera, Glimpsing Worlds Too Fast for the Eye"
0,World’s largest ice 'Father Christmas' built in China
0,Suspect charged in murder of Lauren Burk
0,Kim Yu-na Skates While Carrying the Hopes of South Korea
1,22 Things Your Sarcastic Inner Voice Wants To Say
1,Here Are Things That People Actually Said About Muslims In 2015
1,17 Beer Fests Around The World That Aren't Oktoberfest
0,"Guided Into Tunnel, Ticket Holders Missed Swearing-In"
0,Israel announces settlement expansion plans
1,People Try Pumpkin-Flavored Treats
0,Washington Churches Eye the Obamas
0,"Stressing Long-Term Focus, Blackstone Bounces Back"
1,20 Cavity-Inducing Snacks That You'd Beg Your Mom For In Elementary School
0,Long Island-sized iceberg to ram Antarctic coast
0,Texas continues to suffer record-breaking drought
1,22 Times Anthropologie Went Way Too Far
1,Non-Mexicans Try To Guess The Meaning Of Mexican Slang
1,17 Struggles That Are All Too Real For Anyone Who Grew Up With Strict Parents
0,Heikki Kovalainen wins 2008 Hungarian Grand Prix
0,New Jersey gives $270 million to Stem Cell Research Center
1,Can You Name The TV Show Based Off One GIF
0,Santana Provides Cure for All That Ails Mets
1,18 Things Every Beer Drinker Needs To Know
0,"OPEC Keeps Output Goals Unchanged, Saudi Says"
1,Jennifer Lawrence And Aziz Ansari Are Our New Friendship Goals
0,Microsoft acquires VoIP firm
0,Ohio Seeks to End Interest Abuses in Payday Loans
0,Gale Norton resigns as U.S. Secretary of the Interior
0,Ross on Wye Friends win gold for garden
1,12 Decadent Hot Chocolate Recipes That Are Better Than Sex
1,15 Holiday Treats That Are Basically The Reason For The Season
0,Jenny Li and Thomas Dold win the 2008 Taipei 101 Run Up
0,Rodrigo Ortúzar announces plans to dramatize Chilean miners' stories
0,The Sharper Image Brand Outlives the Stores
0,Fifth bomb discovered in London after July 21 attacks
